{"actions":{"a1":{"args":{"to":{"bind":"$.place.coords"}},"kind":"propose","tool":"open_directions"}},"data":{"meeting":{"summary":"Design review at **11:00**."},"place":{"coords":[38.72,-9.14],"name":"Lisbon"}},"nodes":{"n1":{"props":{"ratio":0.6},"slots":{"left":["n2"],"right":["n3"]},"type":"Split"},"n2":{"props":{"center":{"bind":"$.place.coords"},"zoom":12},"type":"Map"},"n3":{"actions":{"primary":{"id":"a1","label":"Navigate"}},"props":{"title":"Next meeting"},"slots":{"body":["n4"]},"type":"Card"},"n4":{"props":{"text":{"bind":"$.meeting.summary"}},"type":"Markdown"}},"root":"n1","spec_version":1}
